{
  "id": "00000000-0000-4000-8000-000000000002",
  "job": "opportunity-register",
  "tool_version": "2.1.0",
  "tool_commit": "d8a4835",
  "author": "chris",
  "created_at": "2026-09-25T10:00:00Z",
  "client_id": "frontera",
  "project_id": "llanos-screen",
  "asset_ids": [
    "field:llanos:cubiro"
  ],
  "legal_tag": "lt-frontera-nda-2026",
  "title": "Cubiro waterflood screen",
  "inputs": [
    {
      "ref": "ref:price_decks/brent-2026-09",
      "kind": "reference",
      "version": "2026-09",
      "hash": "sha256:aaaaaaaaaaaaaaaaaaaaaaaaaaaaaaaaaaaaaaaaaaaaaaaaaaaaaaaaaaaaaaaa",
      "role": "price_deck"
    }
  ],
  "assumptions": {
    "oil_viscosity_cp": {
      "value": 3,
      "unit": "cP",
      "source": "analogue",
      "provenance": "analogue"
    }
  },
  "params": {
    "play": "onshore-clastic-waterflood",
    "k": 150,
    "hFt": 45
  },
  "outputs": {
    "technical_potential_bopd": {
      "value": 4200,
      "unit": "bopd",
      "low": 2900,
      "high": 6100
    }
  },
  "input_hash": "sha256:aaaaaaaaaaaaaaaaaaaaaaaaaaaaaaaaaaaaaaaaaaaaaaaaaaaaaaaaaaaaaaaa",
  "status": "final",
  "reviewed_by": "partner2",
  "parents": [
    "00000000-0000-4000-8000-000000000001"
  ],
  "tags": [
    "vintage-2026-q3"
  ]
}
