{
  "id": "00000000-0000-4000-8000-000000000003",
  "job": "apex-reservoir-3d",
  "tool_version": "2.2.0",
  "tool_commit": "661d20d",
  "author": "chris",
  "created_at": "2026-09-25T10:00:00Z",
  "client_id": "frontera",
  "project_id": "llanos-screen",
  "asset_ids": [
    "field:llanos:cubiro"
  ],
  "legal_tag": "lt-frontera-nda-2026",
  "title": "Cubiro waterflood screen",
  "inputs": [
    {
      "ref": "run:00000000-0000-4000-8000-000000000001",
      "kind": "run",
      "version": "2.1.0",
      "hash": "sha256:aaaaaaaaaaaaaaaaaaaaaaaaaaaaaaaaaaaaaaaaaaaaaaaaaaaaaaaaaaaaaaaa",
      "role": "seed_model"
    }
  ],
  "assumptions": {
    "oil_viscosity_cp": {
      "value": 3,
      "unit": "cP",
      "source": "analogue",
      "provenance": "analogue"
    }
  },
  "params": {
    "play": "onshore-clastic-waterflood",
    "k": 150,
    "hFt": 45
  },
  "outputs": {
    "recovery_factor": {
      "value": 0.31
    }
  },
  "input_hash": "sha256:aaaaaaaaaaaaaaaaaaaaaaaaaaaaaaaaaaaaaaaaaaaaaaaaaaaaaaaaaaaaaaaa",
  "status": "draft"
}
